{
  "interlockings": {
    "Corporal": {
      "codelines": [
        {
          "address": "Corporal",
          "codeline": "AAR Tokens@MQTT"
        }
      ],
      "fieldUnit": {
        "host": "Corporal"
      }
    },
    "Gilroy Caltrain": {
      "appliances": {
        "773": {
          "appliance": "switch",
          "controlPoint": "Gilroy Caltrain:Gilroy Caltrain",
          "style": "powered"
        },
        "774NAB": {
          "appliance": "mast",
          "heads": {
            "A": {
              "style": "CPL"
            },
            "B": {
              "style": "CPL"
            }
          },
          "style": "double"
        }
      },
      "codelines": [
        {
          "address": "Gilroy Caltrain",
          "codeline": "AAR Tokens@MQTT"
        }
      ],
      "controlPoints": {
        "Gilroy Caltrain": {}
      },
      "devices": [
        {
          "bindings": [
            {
              "chip": "Caltrain/CMRI",
              "function": "LAMP",
              "pin": "OUT.7"
            }
          ],
          "serves": "Gilroy Caltrain:774NAB",
          "type": {
            "appliance": "head"
          }
        },
        {
          "bindings": [
            {
              "chip": "Caltrain/CMRI",
              "function": "N",
              "pin": "OUT.1"
            },
            {
              "chip": "Caltrain/CMRI",
              "function": "NWK",
              "pin": "IN.1"
            }
          ],
          "serves": "Gilroy Caltrain:773",
          "type": {
            "appliance": "switch",
            "style": "powered"
          }
        }
      ],
      "fieldUnit": {
        "host": "CMRI Host"
      }
    },
    "Gilroy Interchange": {
      "appliances": {
        "777": {
          "appliance": "switch",
          "controlPoint": "Gilroy Interchange:Gilroy North",
          "osCircuit": "Gilroy Interchange:777T1",
          "style": "lock"
        },
        "781": {
          "appliance": "switch",
          "controlPoint": "Gilroy Interchange:Gilroy South",
          "osCircuit": "Gilroy Interchange:781T1",
          "style": "lock"
        }
      },
      "codelines": [
        {
          "address": "Gilroy Interchange",
          "codeline": "AAR Tokens@MQTT"
        }
      ],
      "controlPoints": {
        "Gilroy North": {
          "milepost": 77.7
        },
        "Gilroy South": {
          "milepost": 78.1
        }
      },
      "devices": [
        {
          "bindings": [
            {
              "chip": "JMRI/MQTT",
              "function": "M",
              "pin": "Turnout"
            },
            {
              "chip": "JMRI/MQTT",
              "function": "N",
              "pin": "Turnout-Feedback.N"
            },
            {
              "chip": "JMRI/MQTT",
              "function": "R",
              "pin": "Turnout-Feedback.R"
            }
          ],
          "serves": "Gilroy Interchange:777",
          "type": {
            "appliance": "switch",
            "style": [
              "dual",
              "lock",
              "powered"
            ]
          }
        }
      ],
      "fieldUnit": {
        "host": "JMRI Host"
      }
    },
    "Luchessa": {
      "codelines": [
        {
          "address": "Luchessa",
          "codeline": "AAR Tokens@MQTT"
        }
      ],
      "controlPoints": {
        "CP Carnadero": {},
        "CP Gilroy": {},
        "CP Luchessa": {}
      },
      "fieldUnit": {
        "host": "Luchessa"
      }
    },
    "Sargent": {
      "appliances": {
        "835": {
          "appliance": "switch",
          "controlPoint": "Sargent:Sargent",
          "osCircuit": "Sargent:835T1",
          "style": "lock"
        },
        "836NAB": {
          "appliance": "mast",
          "heads": {
            "A": {
              "style": "CPL"
            },
            "B": {
              "style": "CPL"
            }
          },
          "style": "double"
        }
      },
      "codelines": [
        {
          "address": "Sargent",
          "codeline": "AAR Tokens@MQTT"
        }
      ],
      "controlPoints": {
        "Sargent": {
          "milepost": 83.5
        }
      },
      "devices": [
        {
          "address": "1",
          "bindings": [
            {
              "chip": "Sargent/0x40/pwm",
              "function": "LAMP",
              "pin": "B1"
            }
          ],
          "serves": "Sargent:836NAB",
          "type": {
            "appliance": "head"
          }
        },
        {
          "bindings": [
            {
              "chip": "Sargent/0x20",
              "function": "M",
              "pin": "B1"
            },
            {
              "chip": "Sargent/0x20",
              "function": "N",
              "pin": "B2"
            }
          ],
          "serves": "Sargent:835",
          "type": {
            "appliance": "switch",
            "style": [
              "dual",
              "lock",
              "powered"
            ]
          }
        }
      ],
      "fieldUnit": {
        "host": "Sargent"
      }
    },
    "Watsonville": {
      "codelines": [
        {
          "address": "Watsonville",
          "codeline": "AAR Tokens@MQTT"
        }
      ],
      "description": "Day 0: no field processor yet; its devices are absent and the emulator mocks them",
      "fieldUnit": {
        "host": "Plant Host"
      }
    }
  },
  "layout": {
    "codelines": {
      "AAR Tokens@MQTT": {
        "encoding": "AAR",
        "transport": "MQTT"
      }
    },
    "division": "South",
    "name": "SPCoast",
    "processors": {
      "Caltrain": {
        "address": "30",
        "board": "cpNode",
        "chips": {
          "CMRI": {
            "ic": "CMRI"
          }
        },
        "side": "field",
        "transport": "CMRInet"
      },
      "CMRI Host": {
        "board": "macOS app",
        "description": "FieldUnit + CMRInet host: runs the logic of the all-CMRI field units and polls the line",
        "side": "field"
      },
      "Corporal": {
        "board": "cpNode Xiao",
        "chips": {
          "0x20": {
            "ic": "MCP23017"
          }
        },
        "side": "field"
      },
      "JMRI": {
        "board": "JMRI",
        "chips": {
          "MQTT": {
            "ic": "JMRI"
          }
        },
        "description": "Remote I/O node: JMRI drives the devices over MQTT; a pin is the JMRI object a driver stands for (simpleton)",
        "side": "field",
        "transport": "MQTT"
      },
      "JMRI Host": {
        "board": "macOS app",
        "description": "FieldUnit + MQTT client: runs the logic of the all-JMRI field units",
        "side": "field"
      },
      "Luchessa": {
        "board": "cpNode Xiao",
        "chips": {
          "0x20": {
            "ic": "MCP23017"
          },
          "0x21": {
            "ic": "MCP23017"
          }
        },
        "side": "field"
      },
      "Plant Host": {
        "board": "macOS app",
        "description": "Day 0: hosts the field units that have no field processor yet; their devices are absent and the emulator mocks them",
        "side": "field"
      },
      "Sargent": {
        "board": "cpNode Xiao",
        "chips": {
          "0x20": {
            "ic": "MCP23017"
          },
          "0x40/pwm": {
            "ic": "PCA9685"
          },
          "0x40/servo": {
            "ic": "PCA9685"
          }
        },
        "side": "field"
      },
      "SPCoast South": {
        "board": "ESP32",
        "chips": {
          "0x2C": {
            "ic": "MAX7313"
          }
        },
        "side": "office"
      }
    },
    "railroad": "SPCoast",
    "settings": {
      "era": "1970s",
      "rulebook": "SP 1969"
    },
    "transports": {
      "CMRInet": {
        "host": "CMRI Host",
        "kind": "CMRI",
        "params": {
          "baud": "28800",
          "port": "/dev/cu.usbserial-CMRI"
        }
      },
      "MQTT": {
        "kind": "MQTT",
        "params": {
          "broker": "192.168.1.21:1883",
          "topic": "ctc/SPCoast/codeline/"
        }
      }
    }
  },
  "machines": {
    "SPCoast South": {
      "attachments": [
        {
          "codeline": "AAR Tokens@MQTT",
          "columns": [
            "13"
          ],
          "interlocking": "Sargent"
        }
      ],
      "columns": {
        "13": {
          "interlocking": "Sargent"
        }
      },
      "devices": [
        {
          "bindings": [
            {
              "chip": "SPCoast South/0x2C",
              "function": "WLS",
              "pin": "A7"
            }
          ],
          "column": "SPCoast South:13",
          "serves": "Sargent:835",
          "type": {
            "appliance": "lever",
            "style": "lock"
          }
        }
      ],
      "officeUnit": {
        "host": "SPCoast South"
      },
      "panelStyle": "US&S 506 lever panel"
    }
  },
  "provenance": {
    "compiler": {
      "name": "kicad2layout",
      "version": "0.0.0-example"
    },
    "libraries": {
      "Railroad-Field": "example",
      "Railroad-HardwareIO": "example",
      "Railroad-Office": "example",
      "Railroad-Trackplan": "example"
    },
    "referenceData": {
      "boards": "example",
      "chips": "example",
      "encodings": "example"
    },
    "source": {
      "describe": "example",
      "path": "SPCoast/SPCoast.kicad_pro",
      "sha256": "50d858e0985ecc7f60418aaf0cc5ab587f42c2570a884095a9e8ccacd0f6545c"
    },
    "sourceType": "KiCad"
  },
  "schema": "layout-model/v2.0.0"
}
